CREATE TABLE t1(c1 INT) ENGINE= InnoDB;
select @@session.gtid_next;
@@session.gtid_next
AUTOMATIC
# Crash in XA PREPARE right after flushing InnoDB redo log
SET SESSION DEBUG="+d,crash_after_flush_engine_log";
XA START '1';
INSERT INTO t1 VALUES(1);
XA END '1';
XA PREPARE '1';
ERROR HY000: Lost connection to MySQL server during query
# Restart the master server
#
# XA txn '1' should be aborted during binlog recovery.
# no prepared txn expected
XA RECOVER;
formatID	gtrid_length	bqual_length	data
include/assert.inc [Table t1 must not contain 1]
select*from t1;
c1
# Crash in XA COMMIT ONE PHASE right after flushing InnoDB redo log
SET SESSION DEBUG="+d,crash_after_flush_engine_log";
XA START '2';
INSERT INTO t1 VALUES(2);
XA END '2';
XA COMMIT  '2' ONE PHASE;
ERROR HY000: Lost connection to MySQL server during query
# wait for server restart
# Restart the master server
#
# XA txn '2' should be aborted during binlog recovery.
# no prepared txn expected
XA RECOVER;
formatID	gtrid_length	bqual_length	data
include/assert.inc [Table t1 must not contain 2]
select*from t1;
c1
# Crash in XA COMMIT right before commit
XA START '3';
INSERT INTO t1 VALUES(3);
XA END '3';
XA PREPARE '3';
SET SESSION DEBUG="+d,crash_commit_before_log";
XA COMMIT '3';
ERROR HY000: Lost connection to MySQL server during query
# Restart the master server
#
# XA txn '3' should be left prepared, and its effect should be only visible after it's committed.
# prepared XA txn '3' expected
XA RECOVER;
formatID	gtrid_length	bqual_length	data
1	1	0	3
include/assert.inc [Table t1 must not contain 3]
XA COMMIT '3';
include/assert.inc [Table t1 must contain 3]
select*from t1;
c1
3
# Crash in XA COMMIT right after engine commit.
XA START '4';
delete from t1;
XA END '4';
XA PREPARE '4';
SET SESSION DEBUG="+d,crash_commit_after_log";
XA COMMIT '4';
ERROR HY000: Lost connection to MySQL server during query
# Restart the master server
#
# XA txn '4' should have been committed before the crash.
# No prepared XA txn expected
XA RECOVER;
formatID	gtrid_length	bqual_length	data
include/assert.inc [Table t1 must not contain 4]
# Crash in XA PREPARE right after flushing binlog
SET SESSION DEBUG="+d,crash_after_flush_binlog";
XA START '5';
INSERT INTO t1 VALUES(5);
XA END '5';
XA PREPARE '5';
ERROR HY000: Lost connection to MySQL server during query
# Restart the master server
#
# XA txn '5' should be left prepared during binlog recovery.
XA RECOVER;
formatID	gtrid_length	bqual_length	data
1	1	0	5
include/assert.inc [Table t1 must not contain 5]
XA COMMIT '5';
include/assert.inc [Table t1 must contain 5]
select*from t1;
c1
5
# cleanup t1
delete from t1;
# Crash in XA COMMIT ONE PHASE right after flushing binlog
SET SESSION DEBUG="+d,crash_after_flush_binlog";
XA START '6';
INSERT INTO t1 VALUES(6);
XA END '6';
XA COMMIT  '6' ONE PHASE;
ERROR HY000: Lost connection to MySQL server during query
# Restart the master server
#
# XA txn '6' should be committed during binlog recovery.
# no prepared txn expected
XA RECOVER;
formatID	gtrid_length	bqual_length	data
include/assert.inc [Table t1 must contain 6]
select*from t1;
c1
6
# cleanup t1
delete from t1;
# Crash in XA COMMIT right after flushing binlog.
XA START '7';
INSERT INTO t1 VALUES(7);
XA END '7';
XA PREPARE '7';
SET SESSION DEBUG="+d,crash_after_flush_binlog";
XA COMMIT '7';
ERROR HY000: Lost connection to MySQL server during query
# Restart the master server
#
# XA txn '7' should be committed during binlog recovery.
# No prepared XA txn expected
XA RECOVER;
formatID	gtrid_length	bqual_length	data
include/assert.inc [Table t1 must contain 7]
select*from t1;
c1
7
delete from t1;
# Crash in XA ROLLBACK right after flushing binlog
XA START '8';
INSERT INTO t1 VALUES(8);
XA END '8';
XA PREPARE '8';
SET SESSION DEBUG="+d,crash_after_flush_binlog";
XA ROLLBACK '8';
ERROR HY000: Lost connection to MySQL server during query
# Restart the master server
#
# XA txn '8' should be aborted during binlog recovery.
# No prepared XA txn expected
XA RECOVER;
formatID	gtrid_length	bqual_length	data
include/assert.inc [Table t1 must contain 8]
select*from t1;
c1
drop table t1;
